{
  "schemaVersion": "fenrua.key-metadata.v1",
  "keyId": "urn:fenrua:key:demo-ed25519",
  "scope": {
    "tenantId": "urn:fenrua:tenant:demo",
    "environmentId": "urn:fenrua:environment:development"
  },
  "ownerId": "urn:fenrua:organisation:fenrua",
  "algorithm": "ed25519",
  "signatureProfiles": ["ed25519-v1"],
  "lifecycle": "active",
  "createdAt": "2026-07-14T00:00:00.000Z",
  "activatedAt": "2026-07-14T00:00:00.000Z",
  "expiresAt": "2026-07-15T00:00:00.000Z",
  "publicKeyDigest": {
    "algorithm": "sha-256",
    "value": "aaaaaaaaaaaaaaaaaaaaaaaaaaaaaaaaaaaaaaaaaaaaaaaaaaaaaaaaaaaaaaaa"
  },
  "evidenceRefs": [
    {
      "evidenceBundleId": "urn:fenrua:evidence-bundle:bootstrap-evidence",
      "digest": {
        "algorithm": "sha-256",
        "value": "aaaaaaaaaaaaaaaaaaaaaaaaaaaaaaaaaaaaaaaaaaaaaaaaaaaaaaaaaaaaaaaa"
      },
      "createdAt": "2026-07-14T00:00:00.000Z"
    }
  ],
  "signature": {
    "profile": "local-unsigned-development",
    "keyId": "urn:fenrua:key:local-unsigned-development",
    "payloadDigest": {
      "algorithm": "sha-256",
      "value": "aaaaaaaaaaaaaaaaaaaaaaaaaaaaaaaaaaaaaaaaaaaaaaaaaaaaaaaaaaaaaaaa"
    }
  }
}
